

================================================================
== Vitis HLS Report for 'DoCompute_Block_ZN25WidthAdjustedOutputStreamILj16ELj128ELj1152EED2Ev_exit_loop'
================================================================
* Date:           Thu May 29 09:35:49 2025

* Version:        2023.2.2 (Build 4101106 on Feb  9 2024)
* Project:        hw
* Solution:       solution1 (Vivado IP Flow Target)
* Product family: zynq
* Target device:  xc7z020-clg400-1


================================================================
== Performance Estimates
================================================================
+ Timing: 
    * Summary: 
    +--------+----------+----------+------------+
    |  Clock |  Target  | Estimated| Uncertainty|
    +--------+----------+----------+------------+
    |ap_clk  |  10.00 ns|  6.186 ns|     2.70 ns|
    +--------+----------+----------+------------+

+ Latency: 
    * Summary: 
    +---------+---------+----------+----------+-----+-----+---------+
    |  Latency (cycles) |  Latency (absolute) |  Interval | Pipeline|
    |   min   |   max   |    min   |    max   | min | max |   Type  |
    +---------+---------+----------+----------+-----+-----+---------+
    |        0|        0|      0 ns|      0 ns|    0|    0|       no|
    +---------+---------+----------+----------+-----+-----+---------+

    + Detail: 
        * Instance: 
        N/A

        * Loop: 
        N/A

============================================================
+ Verbose Summary: Synthesis Manager
============================================================
InlineROM: 1
ExposeGlobal: 0
============================================================
+ Verbose Summary: CDFG Model
============================================================
IsTopModel: 0
ResetActiveHigh: 1
IsCombinational: 2
IsDatapathOnly: 0
HasWiredReturn: 1
HasMFsm: 0
HasVarLatency: 0
IsPipeline: 0
IsRtlPipelined: 0
IsInstanceOverlapped: 0
IsDontTouch: 0
HasImplIP: 0
IsGatedGlobalClock: 0


============================================================
+ Verbose Summary: Schedule
============================================================
* Number of FSM states : 1
* Pipeline : 0
* Dataflow Pipeline: 0

* FSM state transitions: 
1 --> 

* FSM state operations: 

State 1 <SV = 0> <Delay = 6.18>
ST_1 : Operation 2 [1/1] (3.63ns)   --->   "%numReps_read = read i26 @_ssdm_op_Read.ap_auto.i26, i26 %numReps" [../streamtools.h:265->../streamtools.h:720->../convlayer.h:113->../top.cpp:134]   --->   Operation 2 'read' 'numReps_read' <Predicate = true> <Delay = 3.63> <CoreInst = "FIFO_SRL">   --->   Core 81 'FIFO_SRL' <Latency = 0> <II = 1> <Delay = 3.63> <Storage> <Opcode : 'read' 'write' 'nbread' 'nbwrite'> <Ports = 0> <Width = -1> <Depth = -1> <FIFO>
ST_1 : Operation 3 [1/1] (0.00ns)   --->   "%trunc_ln265 = trunc i26 %numReps_read" [../streamtools.h:265->../streamtools.h:720->../convlayer.h:113->../top.cpp:134]   --->   Operation 3 'trunc' 'trunc_ln265' <Predicate = true> <Delay = 0.00>
ST_1 : Operation 4 [1/1] (0.00ns)   --->   "%tmp = bitconcatenate i32 @_ssdm_op_BitConcatenate.i32.i23.i9, i23 %trunc_ln265, i9 0" [../streamtools.h:265->../streamtools.h:720->../convlayer.h:113->../top.cpp:134]   --->   Operation 4 'bitconcatenate' 'tmp' <Predicate = true> <Delay = 0.00>
ST_1 : Operation 5 [1/1] (0.00ns)   --->   "%totalIters = bitconcatenate i32 @_ssdm_op_BitConcatenate.i32.i26.i6, i26 %numReps_read, i6 0" [../streamtools.h:265->../streamtools.h:720->../convlayer.h:113->../top.cpp:134]   --->   Operation 5 'bitconcatenate' 'totalIters' <Predicate = true> <Delay = 0.00>
ST_1 : Operation 6 [1/1] (2.55ns)   --->   "%totalIters_1 = add i32 %tmp, i32 %totalIters" [../streamtools.h:265->../streamtools.h:720->../convlayer.h:113->../top.cpp:134]   --->   Operation 6 'add' 'totalIters_1' <Predicate = true> <Delay = 2.55> <CoreInst = "Adder">   --->   Core 1 'Adder' <Latency = 0> <II = 1> <Delay = 2.55> <FuncUnit> <Opcode : 'add' 'sub'> <InPorts = 2> <OutPorts = 1>
ST_1 : Operation 7 [1/1] (0.00ns)   --->   "%mrv_i = insertvalue i96 <undef>, i32 %totalIters_1" [../streamtools.h:265->../streamtools.h:720->../convlayer.h:113->../top.cpp:134]   --->   Operation 7 'insertvalue' 'mrv_i' <Predicate = true> <Delay = 0.00>
ST_1 : Operation 8 [1/1] (0.00ns)   --->   "%mrv_1_i = insertvalue i96 %mrv_i, i32 %totalIters" [../streamtools.h:265->../streamtools.h:720->../convlayer.h:113->../top.cpp:134]   --->   Operation 8 'insertvalue' 'mrv_1_i' <Predicate = true> <Delay = 0.00>
ST_1 : Operation 9 [1/1] (0.00ns)   --->   "%mrv_2_i = insertvalue i96 %mrv_1_i, i32 %tmp" [../streamtools.h:265->../streamtools.h:720->../convlayer.h:113->../top.cpp:134]   --->   Operation 9 'insertvalue' 'mrv_2_i' <Predicate = true> <Delay = 0.00>
ST_1 : Operation 10 [1/1] (0.00ns)   --->   "%ret_ln265 = ret i96 %mrv_2_i" [../streamtools.h:265->../streamtools.h:720->../convlayer.h:113->../top.cpp:134]   --->   Operation 10 'ret' 'ret_ln265' <Predicate = true> <Delay = 0.00>


============================================================
+ Verbose Summary: Timing violations
============================================================
Target clock period: 10.000ns, clock uncertainty: 2.700ns.

 <State 1>: 6.186ns
The critical path consists of the following:
	wire read operation ('numReps_read', ../streamtools.h:265->../streamtools.h:720->../convlayer.h:113->../top.cpp:134) on port 'numReps' (../streamtools.h:265->../streamtools.h:720->../convlayer.h:113->../top.cpp:134) [2]  (3.634 ns)
	'add' operation 32 bit ('totalIters', ../streamtools.h:265->../streamtools.h:720->../convlayer.h:113->../top.cpp:134) [6]  (2.552 ns)


============================================================
+ Verbose Summary: Binding
============================================================
N/A
* FSMD analyzer results:
  - Output states:
 - Input state : 
  - Chain level:
	State 1


============================================================
+ Verbose Summary: Datapath Resource usage 
============================================================
N/A
