

================================================================
== Vitis HLS Report for 'DoCompute_Loop_VITIS_LOOP_268_1_proc9'
================================================================
* Date:           Thu May 29 09:36:02 2025

* Version:        2023.2.2 (Build 4101106 on Feb  9 2024)
* Project:        hw
* Solution:       solution1 (Vivado IP Flow Target)
* Product family: zynq
* Target device:  xc7z020-clg400-1


================================================================
== Performance Estimates
================================================================
+ Timing: 
    * Summary: 
    +--------+----------+----------+------------+
    |  Clock |  Target  | Estimated| Uncertainty|
    +--------+----------+----------+------------+
    |ap_clk  |  10.00 ns|  8.978 ns|     2.70 ns|
    +--------+----------+----------+------------+

+ Latency: 
    * Summary: 
    +---------+---------+----------+----------+-----+-----+---------+
    |  Latency (cycles) |  Latency (absolute) |  Interval | Pipeline|
    |   min   |   max   |    min   |    max   | min | max |   Type  |
    +---------+---------+----------+----------+-----+-----+---------+
    |        ?|        ?|         ?|         ?|    ?|    ?|       no|
    +---------+---------+----------+----------+-----+-----+---------+

    + Detail: 
        * Instance: 
        N/A

        * Loop: 
        +--------------------+---------+---------+----------+-----------+-----------+------+----------+
        |                    |  Latency (cycles) | Iteration|  Initiation Interval  | Trip |          |
        |      Loop Name     |   min   |   max   |  Latency |  achieved |   target  | Count| Pipelined|
        +--------------------+---------+---------+----------+-----------+-----------+------+----------+
        |- VITIS_LOOP_268_1  |        ?|        ?|         3|          1|          1|     ?|       yes|
        +--------------------+---------+---------+----------+-----------+-----------+------+----------+

============================================================
+ Verbose Summary: Synthesis Manager
============================================================
InlineROM: 1
ExposeGlobal: 0
============================================================
+ Verbose Summary: CDFG Model
============================================================
IsTopModel: 0
ResetActiveHigh: 1
IsCombinational: 2
IsDatapathOnly: 0
HasWiredReturn: 1
HasMFsm: 2
HasVarLatency: 1
IsPipeline: 0
IsRtlPipelined: 0
IsInstanceOverlapped: 0
IsDontTouch: 0
HasImplIP: 0
IsGatedGlobalClock: 0

+ Individual pipeline summary: 
  * Pipeline-0: initiation interval (II) = 1, depth = 3


============================================================
+ Verbose Summary: Schedule
============================================================
* Number of FSM states : 3
* Pipeline : 1
  Pipeline-0 : II = 1, D = 3, States = { 1 2 3 }
* Dataflow Pipeline: 0

* FSM state transitions: 
1 --> 2 
2 --> 3 
3 --> 

* FSM state operations: 

State 1 <SV = 0> <Delay = 8.97>
ST_1 : Operation 6 [1/1] (0.00ns)   --->   "%ei = alloca i32 1" [../streamtools.h:267->../streamtools.h:720->../convlayer.h:113->../top.cpp:138]   --->   Operation 6 'alloca' 'ei' <Predicate = true> <Delay = 0.00>
ST_1 : Operation 7 [1/1] (0.00ns)   --->   "%o = alloca i32 1" [../streamtools.h:266->../streamtools.h:720->../convlayer.h:113->../top.cpp:138]   --->   Operation 7 'alloca' 'o' <Predicate = true> <Delay = 0.00>
ST_1 : Operation 8 [1/1] (0.00ns)   --->   "%t = alloca i32 1" [../streamtools.h:268->../streamtools.h:720->../convlayer.h:113->../top.cpp:138]   --->   Operation 8 'alloca' 't' <Predicate = true> <Delay = 0.00>
ST_1 : Operation 9 [1/1] (0.00ns)   --->   "%specinterface_ln0 = specinterface void @_ssdm_op_SpecInterface, i128 %inter6, void @empty_11, i32 0, i32 0, void @empty_22, i32 0, i32 0, void @empty_22, void @empty_22, void @empty_22, i32 0, i32 0, i32 0, i32 0, void @empty_22, void @empty_22, i32 4294967295, i32 0"   --->   Operation 9 'specinterface' 'specinterface_ln0' <Predicate = true> <Delay = 0.00>
ST_1 : Operation 10 [1/1] (0.00ns)   --->   "%specinterface_ln0 = specinterface void @_ssdm_op_SpecInterface, i32 %wa_in_9, void @empty_11, i32 0, i32 0, void @empty_22, i32 0, i32 0, void @empty_22, void @empty_22, void @empty_22, i32 0, i32 0, i32 0, i32 0, void @empty_22, void @empty_22, i32 4294967295, i32 0"   --->   Operation 10 'specinterface' 'specinterface_ln0' <Predicate = true> <Delay = 0.00>
ST_1 : Operation 11 [1/1] (3.63ns)   --->   "%p_read_9 = read i32 @_ssdm_op_Read.ap_auto.i32, i32 %p_read"   --->   Operation 11 'read' 'p_read_9' <Predicate = true> <Delay = 3.63> <CoreInst = "FIFO_SRL">   --->   Core 81 'FIFO_SRL' <Latency = 0> <II = 1> <Delay = 3.63> <Storage> <Opcode : 'read' 'write' 'nbread' 'nbwrite'> <Ports = 0> <Width = -1> <Depth = -1> <FIFO>
ST_1 : Operation 12 [1/1] (1.58ns)   --->   "%store_ln268 = store i32 0, i32 %t" [../streamtools.h:268->../streamtools.h:720->../convlayer.h:113->../top.cpp:138]   --->   Operation 12 'store' 'store_ln268' <Predicate = true> <Delay = 1.58>
ST_1 : Operation 13 [1/1] (1.58ns)   --->   "%store_ln266 = store i32 0, i32 %o" [../streamtools.h:266->../streamtools.h:720->../convlayer.h:113->../top.cpp:138]   --->   Operation 13 'store' 'store_ln266' <Predicate = true> <Delay = 1.58>
ST_1 : Operation 15 [1/1] (0.00ns)   --->   "%br_ln268 = br void %for.body.i.i145.i" [../streamtools.h:268->../streamtools.h:720->../convlayer.h:113->../top.cpp:138]   --->   Operation 15 'br' 'br_ln268' <Predicate = true> <Delay = 0.00>
ST_1 : Operation 16 [1/1] (0.00ns)   --->   "%o_6 = load i32 %o" [../streamtools.h:280->../streamtools.h:720->../convlayer.h:113->../top.cpp:138]   --->   Operation 16 'load' 'o_6' <Predicate = true> <Delay = 0.00>
ST_1 : Operation 17 [1/1] (0.00ns)   --->   "%t_21 = load i32 %t" [../streamtools.h:268->../streamtools.h:720->../convlayer.h:113->../top.cpp:138]   --->   Operation 17 'load' 't_21' <Predicate = true> <Delay = 0.00>
ST_1 : Operation 18 [1/1] (2.55ns)   --->   "%icmp_ln268 = icmp_eq  i32 %t_21, i32 %p_read_9" [../streamtools.h:268->../streamtools.h:720->../convlayer.h:113->../top.cpp:138]   --->   Operation 18 'icmp' 'icmp_ln268' <Predicate = true> <Delay = 2.55> <CoreInst = "Cmp">   --->   Core 9 'Cmp' <Latency = 0> <II = 1> <Delay = 2.55> <FuncUnit> <Opcode : 'icmp'> <InPorts = 2> <OutPorts = 1>
ST_1 : Operation 19 [1/1] (2.55ns)   --->   "%t_22 = add i32 %t_21, i32 1" [../streamtools.h:268->../streamtools.h:720->../convlayer.h:113->../top.cpp:138]   --->   Operation 19 'add' 't_22' <Predicate = true> <Delay = 2.55> <CoreInst = "Adder">   --->   Core 1 'Adder' <Latency = 0> <II = 1> <Delay = 2.55> <FuncUnit> <Opcode : 'add' 'sub'> <InPorts = 2> <OutPorts = 1>
ST_1 : Operation 20 [1/1] (0.00ns)   --->   "%br_ln268 = br i1 %icmp_ln268, void %for.body.i.i145.split.i, void %DoCompute_Loop_VITIS_LOOP_268_1_proc9.exit" [../streamtools.h:268->../streamtools.h:720->../convlayer.h:113->../top.cpp:138]   --->   Operation 20 'br' 'br_ln268' <Predicate = true> <Delay = 0.00>
ST_1 : Operation 21 [1/1] (2.55ns)   --->   "%icmp_ln271 = icmp_eq  i32 %o_6, i32 0" [../streamtools.h:271->../streamtools.h:720->../convlayer.h:113->../top.cpp:138]   --->   Operation 21 'icmp' 'icmp_ln271' <Predicate = (!icmp_ln268)> <Delay = 2.55> <CoreInst = "Cmp">   --->   Core 9 'Cmp' <Latency = 0> <II = 1> <Delay = 2.55> <FuncUnit> <Opcode : 'icmp'> <InPorts = 2> <OutPorts = 1>
ST_1 : Operation 22 [1/1] (2.55ns)   --->   "%o_7 = add i32 %o_6, i32 1" [../streamtools.h:280->../streamtools.h:720->../convlayer.h:113->../top.cpp:138]   --->   Operation 22 'add' 'o_7' <Predicate = (!icmp_ln268)> <Delay = 2.55> <CoreInst = "Adder">   --->   Core 1 'Adder' <Latency = 0> <II = 1> <Delay = 2.55> <FuncUnit> <Opcode : 'add' 'sub'> <InPorts = 2> <OutPorts = 1>
ST_1 : Operation 23 [1/1] (2.55ns)   --->   "%icmp_ln282 = icmp_eq  i32 %o_7, i32 4" [../streamtools.h:282->../streamtools.h:720->../convlayer.h:113->../top.cpp:138]   --->   Operation 23 'icmp' 'icmp_ln282' <Predicate = (!icmp_ln268)> <Delay = 2.55> <CoreInst = "Cmp">   --->   Core 9 'Cmp' <Latency = 0> <II = 1> <Delay = 2.55> <FuncUnit> <Opcode : 'icmp'> <InPorts = 2> <OutPorts = 1>
ST_1 : Operation 24 [1/1] (0.69ns)   --->   "%o_8 = select i1 %icmp_ln282, i32 0, i32 %o_7" [../streamtools.h:282->../streamtools.h:720->../convlayer.h:113->../top.cpp:138]   --->   Operation 24 'select' 'o_8' <Predicate = (!icmp_ln268)> <Delay = 0.69> <CoreInst = "Sel">   --->   Core 73 'Sel' <Latency = 0> <II = 1> <Delay = 0.69> <FuncUnit> <Opcode : 'select'> <InPorts = 3> <OutPorts = 1>
ST_1 : Operation 25 [1/1] (1.58ns)   --->   "%store_ln268 = store i32 %t_22, i32 %t" [../streamtools.h:268->../streamtools.h:720->../convlayer.h:113->../top.cpp:138]   --->   Operation 25 'store' 'store_ln268' <Predicate = (!icmp_ln268)> <Delay = 1.58>
ST_1 : Operation 26 [1/1] (1.58ns)   --->   "%store_ln266 = store i32 %o_8, i32 %o" [../streamtools.h:266->../streamtools.h:720->../convlayer.h:113->../top.cpp:138]   --->   Operation 26 'store' 'store_ln266' <Predicate = (!icmp_ln268)> <Delay = 1.58>

State 2 <SV = 1> <Delay = 5.11>
ST_2 : Operation 27 [1/1] (3.53ns)   --->   "%ei_3 = read i128 @_ssdm_op_Read.ap_fifo.volatile.i128P0A, i128 %inter6" [../streamtools.h:272->../streamtools.h:720->../convlayer.h:113->../top.cpp:138]   --->   Operation 27 'read' 'ei_3' <Predicate = (!icmp_ln268 & icmp_ln271)> <Delay = 3.53> <CoreInst = "FIFO">   --->   Core 78 'FIFO' <Latency = 0> <II = 1> <Delay = 3.53> <Storage> <Opcode : 'read' 'write' 'nbread' 'nbwrite'> <Ports = 0> <Width = 128> <Depth = 81> <FIFO>
ST_2 : Operation 28 [1/1] (1.58ns)   --->   "%br_ln273 = br void %if.end.i.i155.i" [../streamtools.h:273->../streamtools.h:720->../convlayer.h:113->../top.cpp:138]   --->   Operation 28 'br' 'br_ln273' <Predicate = (!icmp_ln268 & icmp_ln271)> <Delay = 1.58>
ST_2 : Operation 40 [1/1] (0.00ns)   --->   "%ret_ln0 = ret"   --->   Operation 40 'ret' 'ret_ln0' <Predicate = (icmp_ln268)> <Delay = 0.00>

State 3 <SV = 2> <Delay = 6.81>
ST_3 : Operation 14 [1/1] (1.58ns)   --->   "%store_ln267 = store i96 0, i96 %ei" [../streamtools.h:267->../streamtools.h:720->../convlayer.h:113->../top.cpp:138]   --->   Operation 14 'store' 'store_ln267' <Predicate = true> <Delay = 1.58>
ST_3 : Operation 29 [1/1] (0.00ns)   --->   "%ei_load = load i96 %ei" [../streamtools.h:268->../streamtools.h:720->../convlayer.h:113->../top.cpp:138]   --->   Operation 29 'load' 'ei_load' <Predicate = (!icmp_ln268)> <Delay = 0.00>
ST_3 : Operation 30 [1/1] (0.00ns)   --->   "%zext_ln268 = zext i96 %ei_load" [../streamtools.h:268->../streamtools.h:720->../convlayer.h:113->../top.cpp:138]   --->   Operation 30 'zext' 'zext_ln268' <Predicate = (!icmp_ln268)> <Delay = 0.00>
ST_3 : Operation 31 [1/1] (0.00ns)   --->   "%specpipeline_ln269 = specpipeline void @_ssdm_op_SpecPipeline, i32 1, i32 0, i32 0, i32 0, void @empty_22" [../streamtools.h:269->../streamtools.h:720->../convlayer.h:113->../top.cpp:138]   --->   Operation 31 'specpipeline' 'specpipeline_ln269' <Predicate = (!icmp_ln268)> <Delay = 0.00>
ST_3 : Operation 32 [1/1] (0.00ns)   --->   "%specloopname_ln268 = specloopname void @_ssdm_op_SpecLoopName, void @empty_4" [../streamtools.h:268->../streamtools.h:720->../convlayer.h:113->../top.cpp:138]   --->   Operation 32 'specloopname' 'specloopname_ln268' <Predicate = (!icmp_ln268)> <Delay = 0.00>
ST_3 : Operation 33 [1/1] (1.58ns)   --->   "%br_ln271 = br i1 %icmp_ln271, void %if.end.i.i155.i, void %if.then2.i.i146.i" [../streamtools.h:271->../streamtools.h:720->../convlayer.h:113->../top.cpp:138]   --->   Operation 33 'br' 'br_ln271' <Predicate = (!icmp_ln268)> <Delay = 1.58>
ST_3 : Operation 34 [1/1] (0.00ns)   --->   "%ei_4 = phi i128 %ei_3, void %if.then2.i.i146.i, i128 %zext_ln268, void %for.body.i.i145.split.i"   --->   Operation 34 'phi' 'ei_4' <Predicate = true> <Delay = 0.00>
ST_3 : Operation 35 [1/1] (0.00ns)   --->   "%eo = trunc i128 %ei_4" [../streamtools.h:275->../streamtools.h:720->../convlayer.h:113->../top.cpp:138]   --->   Operation 35 'trunc' 'eo' <Predicate = true> <Delay = 0.00>
ST_3 : Operation 36 [1/1] (3.63ns)   --->   "%write_ln276 = write void @_ssdm_op_Write.ap_fifo.volatile.i32P0A, i32 %wa_in_9, i32 %eo" [../streamtools.h:276->../streamtools.h:720->../convlayer.h:113->../top.cpp:138]   --->   Operation 36 'write' 'write_ln276' <Predicate = true> <Delay = 3.63> <CoreInst = "FIFO_SRL">   --->   Core 81 'FIFO_SRL' <Latency = 0> <II = 1> <Delay = 3.63> <Storage> <Opcode : 'read' 'write' 'nbread' 'nbwrite'> <Ports = 0> <Width = 32> <Depth = 2> <FIFO>
ST_3 : Operation 37 [1/1] (0.00ns)   --->   "%trunc_ln = partselect i96 @_ssdm_op_PartSelect.i96.i128.i32.i32, i128 %ei_4, i32 32, i32 127" [../streamtools.h:280->../streamtools.h:720->../convlayer.h:113->../top.cpp:138]   --->   Operation 37 'partselect' 'trunc_ln' <Predicate = true> <Delay = 0.00>
ST_3 : Operation 38 [1/1] (1.58ns)   --->   "%store_ln267 = store i96 %trunc_ln, i96 %ei" [../streamtools.h:267->../streamtools.h:720->../convlayer.h:113->../top.cpp:138]   --->   Operation 38 'store' 'store_ln267' <Predicate = true> <Delay = 1.58>
ST_3 : Operation 39 [1/1] (0.00ns)   --->   "%br_ln268 = br void %for.body.i.i145.i" [../streamtools.h:268->../streamtools.h:720->../convlayer.h:113->../top.cpp:138]   --->   Operation 39 'br' 'br_ln268' <Predicate = true> <Delay = 0.00>


============================================================
+ Verbose Summary: Timing violations
============================================================
Target clock period: 10.000ns, clock uncertainty: 2.700ns.

 <State 1>: 8.978ns
The critical path consists of the following:
	'store' operation 0 bit ('store_ln266', ../streamtools.h:266->../streamtools.h:720->../convlayer.h:113->../top.cpp:138) of constant 0 on local variable 'o', ../streamtools.h:266->../streamtools.h:720->../convlayer.h:113->../top.cpp:138 [11]  (1.588 ns)
	'load' operation 32 bit ('o', ../streamtools.h:280->../streamtools.h:720->../convlayer.h:113->../top.cpp:138) on local variable 'o', ../streamtools.h:266->../streamtools.h:720->../convlayer.h:113->../top.cpp:138 [15]  (0.000 ns)
	'add' operation 32 bit ('o', ../streamtools.h:280->../streamtools.h:720->../convlayer.h:113->../top.cpp:138) [35]  (2.552 ns)
	'icmp' operation 1 bit ('icmp_ln282', ../streamtools.h:282->../streamtools.h:720->../convlayer.h:113->../top.cpp:138) [36]  (2.552 ns)
	'select' operation 32 bit ('o', ../streamtools.h:282->../streamtools.h:720->../convlayer.h:113->../top.cpp:138) [37]  (0.698 ns)
	'store' operation 0 bit ('store_ln266', ../streamtools.h:266->../streamtools.h:720->../convlayer.h:113->../top.cpp:138) of variable 'o', ../streamtools.h:282->../streamtools.h:720->../convlayer.h:113->../top.cpp:138 on local variable 'o', ../streamtools.h:266->../streamtools.h:720->../convlayer.h:113->../top.cpp:138 [39]  (1.588 ns)

 <State 2>: 5.118ns
The critical path consists of the following:
	fifo read operation ('ei', ../streamtools.h:272->../streamtools.h:720->../convlayer.h:113->../top.cpp:138) on port 'inter6' (../streamtools.h:272->../streamtools.h:720->../convlayer.h:113->../top.cpp:138) [28]  (3.530 ns)
	multiplexor before 'phi' operation 128 bit ('ei') with incoming values : ('zext_ln268', ../streamtools.h:268->../streamtools.h:720->../convlayer.h:113->../top.cpp:138) ('ei', ../streamtools.h:272->../streamtools.h:720->../convlayer.h:113->../top.cpp:138) [31]  (1.588 ns)

 <State 3>: 6.810ns
The critical path consists of the following:
	'store' operation 0 bit ('store_ln267', ../streamtools.h:267->../streamtools.h:720->../convlayer.h:113->../top.cpp:138) of constant 0 on local variable 'ei', ../streamtools.h:267->../streamtools.h:720->../convlayer.h:113->../top.cpp:138 [12]  (1.588 ns)
	'load' operation 96 bit ('ei_load', ../streamtools.h:268->../streamtools.h:720->../convlayer.h:113->../top.cpp:138) on local variable 'ei', ../streamtools.h:267->../streamtools.h:720->../convlayer.h:113->../top.cpp:138 [21]  (0.000 ns)
	multiplexor before 'phi' operation 128 bit ('ei') with incoming values : ('zext_ln268', ../streamtools.h:268->../streamtools.h:720->../convlayer.h:113->../top.cpp:138) ('ei', ../streamtools.h:272->../streamtools.h:720->../convlayer.h:113->../top.cpp:138) [31]  (1.588 ns)
	'phi' operation 128 bit ('ei') with incoming values : ('zext_ln268', ../streamtools.h:268->../streamtools.h:720->../convlayer.h:113->../top.cpp:138) ('ei', ../streamtools.h:272->../streamtools.h:720->../convlayer.h:113->../top.cpp:138) [31]  (0.000 ns)
	fifo write operation ('write_ln276', ../streamtools.h:276->../streamtools.h:720->../convlayer.h:113->../top.cpp:138) on port 'wa_in_9' (../streamtools.h:276->../streamtools.h:720->../convlayer.h:113->../top.cpp:138) [33]  (3.634 ns)


============================================================
+ Verbose Summary: Binding
============================================================
N/A
* FSMD analyzer results:
  - Output states:
 - Input state : 
  - Chain level:
	State 1
	State 2
	State 3


============================================================
+ Verbose Summary: Datapath Resource usage 
============================================================
N/A
