

================================================================
== Vitis HLS Report for 'DoCompute_Loop_VITIS_LOOP_300_3_proc228'
================================================================
* Date:           Thu May 29 09:35:38 2025

* Version:        2023.2.2 (Build 4101106 on Feb  9 2024)
* Project:        hw
* Solution:       solution1 (Vivado IP Flow Target)
* Product family: zynq
* Target device:  xc7z020-clg400-1


================================================================
== Performance Estimates
================================================================
+ Timing: 
    * Summary: 
    +--------+----------+----------+------------+
    |  Clock |  Target  | Estimated| Uncertainty|
    +--------+----------+----------+------------+
    |ap_clk  |  10.00 ns|  7.670 ns|     2.70 ns|
    +--------+----------+----------+------------+

+ Latency: 
    * Summary: 
    +---------+---------+----------+----------+-----+-----+---------+
    |  Latency (cycles) |  Latency (absolute) |  Interval | Pipeline|
    |   min   |   max   |    min   |    max   | min | max |   Type  |
    +---------+---------+----------+----------+-----+-----+---------+
    |        ?|        ?|         ?|         ?|    ?|    ?|       no|
    +---------+---------+----------+----------+-----+-----+---------+

    + Detail: 
        * Instance: 
        N/A

        * Loop: 
        N/A

============================================================
+ Verbose Summary: Synthesis Manager
============================================================
InlineROM: 1
ExposeGlobal: 0
============================================================
+ Verbose Summary: CDFG Model
============================================================
IsTopModel: 0
ResetActiveHigh: 1
IsCombinational: 2
IsDatapathOnly: 0
HasWiredReturn: 1
HasMFsm: 0
HasVarLatency: 1
IsPipeline: 0
IsRtlPipelined: 0
IsInstanceOverlapped: 0
IsDontTouch: 0
HasImplIP: 0
IsGatedGlobalClock: 0


============================================================
+ Verbose Summary: Schedule
============================================================
* Number of FSM states : 4
* Pipeline : 0
* Dataflow Pipeline: 0

* FSM state transitions: 
1 --> 2 
2 --> 3 
3 --> 4 
4 --> 

* FSM state operations: 

State 1 <SV = 0> <Delay = 7.26>
ST_1 : Operation 5 [1/1] (3.63ns)   --->   "%numReps_6 = read i32 @_ssdm_op_Read.ap_fifo.i32P0A, i32 %numReps"   --->   Operation 5 'read' 'numReps_6' <Predicate = true> <Delay = 3.63> <CoreInst = "FIFO_SRL">   --->   Core 81 'FIFO_SRL' <Latency = 0> <II = 1> <Delay = 3.63> <Storage> <Opcode : 'read' 'write' 'nbread' 'nbwrite'> <Ports = 0> <Width = 32> <Depth = 3> <FIFO>
ST_1 : Operation 6 [1/1] (3.63ns)   --->   "%write_ln0 = write void @_ssdm_op_Write.ap_fifo.i32P0A, i32 %numReps_c153, i32 %numReps_6"   --->   Operation 6 'write' 'write_ln0' <Predicate = true> <Delay = 3.63> <CoreInst = "FIFO_SRL">   --->   Core 81 'FIFO_SRL' <Latency = 0> <II = 1> <Delay = 3.63> <Storage> <Opcode : 'read' 'write' 'nbread' 'nbwrite'> <Ports = 0> <Width = 32> <Depth = 2> <FIFO>

State 2 <SV = 1> <Delay = 6.91>
ST_2 : Operation 7 [2/2] (6.91ns)   --->   "%totalIters = mul i32 %numReps_6, i32 1568" [../streamtools.h:297->../streamtools.h:754->../convlayer.h:122->../top.cpp:130]   --->   Operation 7 'mul' 'totalIters' <Predicate = true> <Delay = 6.91> <CoreInst = "Multiplier">   --->   Core 3 'Multiplier' <Latency = 1> <II = 1> <Delay = 6.91> <FuncUnit> <Opcode : 'mul'> <InPorts = 2> <OutPorts = 1>
ST_2 : Operation 8 [1/1] (0.00ns)   --->   "%empty = wait i32 @_ssdm_op_Wait"   --->   Operation 8 'wait' 'empty' <Predicate = true> <Delay = 0.00>

State 3 <SV = 2> <Delay = 6.91>
ST_3 : Operation 9 [1/2] (6.91ns)   --->   "%totalIters = mul i32 %numReps_6, i32 1568" [../streamtools.h:297->../streamtools.h:754->../convlayer.h:122->../top.cpp:130]   --->   Operation 9 'mul' 'totalIters' <Predicate = true> <Delay = 6.91> <CoreInst = "Multiplier">   --->   Core 3 'Multiplier' <Latency = 1> <II = 1> <Delay = 6.91> <FuncUnit> <Opcode : 'mul'> <InPorts = 2> <OutPorts = 1>
ST_3 : Operation 10 [2/2] (0.00ns)   --->   "%call_ln297 = call void @DoCompute_Loop_VITIS_LOOP_300_3_proc228_Pipeline_VITIS_LOOP_300_3, i32 %totalIters, i32 %mvOut_m_buffer_9, i64 %inter2" [../streamtools.h:297->../streamtools.h:754->../convlayer.h:122->../top.cpp:130]   --->   Operation 10 'call' 'call_ln297' <Predicate = true> <Delay = 0.00> <CoreType = "Generic">   --->   Core 0 '' <Latency = 0> <II = 1> <Delay = 1.00> <Generic> <Opcode : >

State 4 <SV = 3> <Delay = 0.00>
ST_4 : Operation 11 [1/1] (0.00ns)   --->   "%specinterface_ln0 = specinterface void @_ssdm_op_SpecInterface, i32 %numReps, void @ap_fifo_str, i32 0, i32 0, void @p_str, i32 0, i32 0, void @p_str, void @p_str, void @p_str, i32 2, i32 2, i32 16, i32 16, void @p_str, void @ScalarProp_str, i32 4294967295, i32 0"   --->   Operation 11 'specinterface' 'specinterface_ln0' <Predicate = true> <Delay = 0.00>
ST_4 : Operation 12 [1/1] (0.00ns)   --->   "%specinterface_ln0 = specinterface void @_ssdm_op_SpecInterface, i32 %numReps_c153, void @ap_fifo_str, i32 0, i32 0, void @p_str, i32 0, i32 0, void @p_str, void @p_str, void @p_str, i32 2, i32 2, i32 16, i32 16, void @p_str, void @ScalarProp_str, i32 4294967295, i32 0"   --->   Operation 12 'specinterface' 'specinterface_ln0' <Predicate = true> <Delay = 0.00>
ST_4 : Operation 13 [1/1] (0.00ns)   --->   "%specinterface_ln0 = specinterface void @_ssdm_op_SpecInterface, i64 %inter2, void @empty_11, i32 0, i32 0, void @empty_22, i32 0, i32 0, void @empty_22, void @empty_22, void @empty_22, i32 0, i32 0, i32 0, i32 0, void @empty_22, void @empty_22, i32 4294967295, i32 0"   --->   Operation 13 'specinterface' 'specinterface_ln0' <Predicate = true> <Delay = 0.00>
ST_4 : Operation 14 [1/1] (0.00ns)   --->   "%specinterface_ln0 = specinterface void @_ssdm_op_SpecInterface, i32 %mvOut_m_buffer_9, void @empty_11, i32 0, i32 0, void @empty_22, i32 0, i32 0, void @empty_22, void @empty_22, void @empty_22, i32 0, i32 0, i32 0, i32 0, void @empty_22, void @empty_22, i32 4294967295, i32 0"   --->   Operation 14 'specinterface' 'specinterface_ln0' <Predicate = true> <Delay = 0.00>
ST_4 : Operation 15 [1/2] (0.00ns)   --->   "%call_ln297 = call void @DoCompute_Loop_VITIS_LOOP_300_3_proc228_Pipeline_VITIS_LOOP_300_3, i32 %totalIters, i32 %mvOut_m_buffer_9, i64 %inter2" [../streamtools.h:297->../streamtools.h:754->../convlayer.h:122->../top.cpp:130]   --->   Operation 15 'call' 'call_ln297' <Predicate = true> <Delay = 0.00> <CoreType = "Generic">   --->   Core 0 '' <Latency = 0> <II = 1> <Delay = 1.00> <Generic> <Opcode : >
ST_4 : Operation 16 [1/1] (0.00ns)   --->   "%ret_ln0 = ret"   --->   Operation 16 'ret' 'ret_ln0' <Predicate = true> <Delay = 0.00>


============================================================
+ Verbose Summary: Timing violations
============================================================
Target clock period: 10.000ns, clock uncertainty: 2.700ns.

 <State 1>: 7.268ns
The critical path consists of the following:
	fifo read operation ('numReps') on port 'numReps' [6]  (3.634 ns)
	fifo write operation ('write_ln0') on port 'numReps_c153' [8]  (3.634 ns)

 <State 2>: 6.912ns
The critical path consists of the following:
	'mul' operation 32 bit ('totalIters', ../streamtools.h:297->../streamtools.h:754->../convlayer.h:122->../top.cpp:130) [11]  (6.912 ns)

 <State 3>: 6.912ns
The critical path consists of the following:
	'mul' operation 32 bit ('totalIters', ../streamtools.h:297->../streamtools.h:754->../convlayer.h:122->../top.cpp:130) [11]  (6.912 ns)

 <State 4>: 0.000ns
The critical path consists of the following:


============================================================
+ Verbose Summary: Binding
============================================================
N/A
* FSMD analyzer results:
  - Output states:
 - Input state : 
  - Chain level:
	State 1
	State 2
	State 3
	State 4


============================================================
+ Verbose Summary: Datapath Resource usage 
============================================================
N/A
