

================================================================
== Vitis HLS Report for 'StreamingMaxPool_Batch_28u_2u_64u_Pipeline_VITIS_LOOP_74_3_VITIS_LOOP_75_4'
================================================================
* Date:           Thu May 29 09:35:38 2025

* Version:        2023.2.2 (Build 4101106 on Feb  9 2024)
* Project:        hw
* Solution:       solution1 (Vivado IP Flow Target)
* Product family: zynq
* Target device:  xc7z020-clg400-1


================================================================
== Performance Estimates
================================================================
+ Timing: 
    * Summary: 
    +--------+----------+----------+------------+
    |  Clock |  Target  | Estimated| Uncertainty|
    +--------+----------+----------+------------+
    |ap_clk  |  10.00 ns|  7.670 ns|     2.70 ns|
    +--------+----------+----------+------------+

+ Latency: 
    * Summary: 
    +---------+---------+----------+----------+-----+-----+---------+
    |  Latency (cycles) |  Latency (absolute) |  Interval | Pipeline|
    |   min   |   max   |    min   |    max   | min | max |   Type  |
    +---------+---------+----------+----------+-----+-----+---------+
    |       58|       58|  0.580 us|  0.580 us|   58|   58|       no|
    +---------+---------+----------+----------+-----+-----+---------+

    + Detail: 
        * Instance: 
        N/A

        * Loop: 
        +-----------------------------------+---------+---------+----------+-----------+-----------+------+----------+
        |                                   |  Latency (cycles) | Iteration|  Initiation Interval  | Trip |          |
        |             Loop Name             |   min   |   max   |  Latency |  achieved |   target  | Count| Pipelined|
        +-----------------------------------+---------+---------+----------+-----------+-----------+------+----------+
        |- VITIS_LOOP_74_3_VITIS_LOOP_75_4  |       56|       56|         3|          2|          1|    28|       yes|
        +-----------------------------------+---------+---------+----------+-----------+-----------+------+----------+

============================================================
+ Verbose Summary: Synthesis Manager
============================================================
InlineROM: 1
ExposeGlobal: 0
============================================================
+ Verbose Summary: CDFG Model
============================================================
IsTopModel: 0
ResetActiveHigh: 1
IsCombinational: 0
IsDatapathOnly: 0
HasWiredReturn: 1
HasMFsm: 2
HasVarLatency: 1
IsPipeline: 0
IsRtlPipelined: 0
IsInstanceOverlapped: 0
IsDontTouch: 0
HasImplIP: 0
IsGatedGlobalClock: 0

+ Individual pipeline summary: 
  * Pipeline-0: initiation interval (II) = 2, depth = 3


============================================================
+ Verbose Summary: Schedule
============================================================
* Number of FSM states : 3
* Pipeline : 1
  Pipeline-0 : II = 2, D = 3, States = { 1 2 3 }
* Dataflow Pipeline: 0

* FSM state transitions: 
1 --> 2 
2 --> 3 
3 --> 

* FSM state operations: 

State 1 <SV = 0> <Delay = 7.67>
ST_1 : Operation 6 [1/1] (0.00ns)   --->   "%xp = alloca i32 1" [../maxpool.h:75->../maxpool.h:110]   --->   Operation 6 'alloca' 'xp' <Predicate = true> <Delay = 0.00>
ST_1 : Operation 7 [1/1] (0.00ns)   --->   "%indvar_flatten = alloca i32 1"   --->   Operation 7 'alloca' 'indvar_flatten' <Predicate = true> <Delay = 0.00>
ST_1 : Operation 8 [1/1] (0.00ns)   --->   "%specinterface_ln0 = specinterface void @_ssdm_op_SpecInterface, i64 %inter2, void @empty_11, i32 0, i32 0, void @empty_22, i32 0, i32 0, void @empty_22, void @empty_22, void @empty_22, i32 0, i32 0, i32 0, i32 0, void @empty_22, void @empty_22, i32 4294967295, i32 0"   --->   Operation 8 'specinterface' 'specinterface_ln0' <Predicate = true> <Delay = 0.00>
ST_1 : Operation 9 [1/1] (1.58ns)   --->   "%store_ln0 = store i5 0, i5 %indvar_flatten"   --->   Operation 9 'store' 'store_ln0' <Predicate = true> <Delay = 1.58>
ST_1 : Operation 10 [1/1] (1.58ns)   --->   "%store_ln75 = store i4 0, i4 %xp" [../maxpool.h:75->../maxpool.h:110]   --->   Operation 10 'store' 'store_ln75' <Predicate = true> <Delay = 1.58>
ST_1 : Operation 11 [1/1] (0.00ns)   --->   "%br_ln0 = br void %VITIS_LOOP_78_5.i"   --->   Operation 11 'br' 'br_ln0' <Predicate = true> <Delay = 0.00>
ST_1 : Operation 12 [1/1] (0.00ns)   --->   "%indvar_flatten_load = load i5 %indvar_flatten" [../maxpool.h:74->../maxpool.h:110]   --->   Operation 12 'load' 'indvar_flatten_load' <Predicate = true> <Delay = 0.00>
ST_1 : Operation 13 [1/1] (1.78ns)   --->   "%icmp_ln74 = icmp_eq  i5 %indvar_flatten_load, i5 28" [../maxpool.h:74->../maxpool.h:110]   --->   Operation 13 'icmp' 'icmp_ln74' <Predicate = true> <Delay = 1.78> <CoreInst = "Cmp">   --->   Core 9 'Cmp' <Latency = 0> <II = 1> <Delay = 1.78> <FuncUnit> <Opcode : 'icmp'> <InPorts = 2> <OutPorts = 1>
ST_1 : Operation 14 [1/1] (1.78ns)   --->   "%add_ln74 = add i5 %indvar_flatten_load, i5 1" [../maxpool.h:74->../maxpool.h:110]   --->   Operation 14 'add' 'add_ln74' <Predicate = true> <Delay = 1.78> <CoreInst = "Adder">   --->   Core 1 'Adder' <Latency = 0> <II = 1> <Delay = 1.78> <FuncUnit> <Opcode : 'add' 'sub'> <InPorts = 2> <OutPorts = 1>
ST_1 : Operation 15 [1/1] (0.00ns)   --->   "%br_ln74 = br i1 %icmp_ln74, void %for.inc27.i, void %for.inc39.i.preheader.exitStub" [../maxpool.h:74->../maxpool.h:110]   --->   Operation 15 'br' 'br_ln74' <Predicate = true> <Delay = 0.00>
ST_1 : Operation 16 [1/1] (0.00ns)   --->   "%xp_load = load i4 %xp" [../maxpool.h:75->../maxpool.h:110]   --->   Operation 16 'load' 'xp_load' <Predicate = (!icmp_ln74)> <Delay = 0.00>
ST_1 : Operation 17 [1/1] (1.73ns)   --->   "%icmp_ln75 = icmp_eq  i4 %xp_load, i4 14" [../maxpool.h:75->../maxpool.h:110]   --->   Operation 17 'icmp' 'icmp_ln75' <Predicate = (!icmp_ln74)> <Delay = 1.73> <CoreInst = "Cmp">   --->   Core 9 'Cmp' <Latency = 0> <II = 1> <Delay = 1.73> <FuncUnit> <Opcode : 'icmp'> <InPorts = 2> <OutPorts = 1>
ST_1 : Operation 18 [1/1] (1.02ns)   --->   "%select_ln74 = select i1 %icmp_ln75, i4 0, i4 %xp_load" [../maxpool.h:74->../maxpool.h:110]   --->   Operation 18 'select' 'select_ln74' <Predicate = (!icmp_ln74)> <Delay = 1.02> <CoreInst = "Sel">   --->   Core 73 'Sel' <Latency = 0> <II = 1> <Delay = 1.02> <FuncUnit> <Opcode : 'select'> <InPorts = 3> <OutPorts = 1>
ST_1 : Operation 19 [1/1] (0.00ns)   --->   "%zext_ln75 = zext i4 %select_ln74" [../maxpool.h:75->../maxpool.h:110]   --->   Operation 19 'zext' 'zext_ln75' <Predicate = (!icmp_ln74)> <Delay = 0.00>
ST_1 : Operation 20 [1/1] (0.00ns)   --->   "%buf_addr = getelementptr i64 %buf_r, i64 0, i64 %zext_ln75" [../maxpool.h:82->../maxpool.h:110]   --->   Operation 20 'getelementptr' 'buf_addr' <Predicate = (!icmp_ln74)> <Delay = 0.00>
ST_1 : Operation 21 [2/2] (2.32ns)   --->   "%buf_load = load i4 %buf_addr" [../maxpool.h:82->../maxpool.h:110]   --->   Operation 21 'load' 'buf_load' <Predicate = (!icmp_ln74)> <Delay = 2.32> <CoreInst = "RAM">   --->   Core 82 'RAM' <Latency = 1> <II = 1> <Delay = 2.32> <Storage> <Opcode : 'load' 'store'> <Ports = 2> <Width = 64> <Depth = 14> <RAM>
ST_1 : Operation 22 [1/1] (1.73ns)   --->   "%add_ln75 = add i4 %select_ln74, i4 1" [../maxpool.h:75->../maxpool.h:110]   --->   Operation 22 'add' 'add_ln75' <Predicate = (!icmp_ln74)> <Delay = 1.73> <CoreInst = "Adder">   --->   Core 1 'Adder' <Latency = 0> <II = 1> <Delay = 1.73> <FuncUnit> <Opcode : 'add' 'sub'> <InPorts = 2> <OutPorts = 1>
ST_1 : Operation 23 [1/1] (1.58ns)   --->   "%store_ln74 = store i5 %add_ln74, i5 %indvar_flatten" [../maxpool.h:74->../maxpool.h:110]   --->   Operation 23 'store' 'store_ln74' <Predicate = (!icmp_ln74)> <Delay = 1.58>
ST_1 : Operation 24 [1/1] (1.58ns)   --->   "%store_ln75 = store i4 %add_ln75, i4 %xp" [../maxpool.h:75->../maxpool.h:110]   --->   Operation 24 'store' 'store_ln75' <Predicate = (!icmp_ln74)> <Delay = 1.58>
ST_1 : Operation 35 [1/1] (0.00ns)   --->   "%ret_ln0 = ret"   --->   Operation 35 'ret' 'ret_ln0' <Predicate = (icmp_ln74)> <Delay = 0.00>

State 2 <SV = 1> <Delay = 3.63>
ST_2 : Operation 25 [1/1] (3.63ns)   --->   "%acc = read i64 @_ssdm_op_Read.ap_fifo.volatile.i64P0A, i64 %inter2" [../maxpool.h:79->../maxpool.h:110]   --->   Operation 25 'read' 'acc' <Predicate = (!icmp_ln74)> <Delay = 3.63> <CoreInst = "FIFO_SRL">   --->   Core 81 'FIFO_SRL' <Latency = 0> <II = 1> <Delay = 3.63> <Storage> <Opcode : 'read' 'write' 'nbread' 'nbwrite'> <Ports = 0> <Width = 64> <Depth = 2> <FIFO>
ST_2 : Operation 26 [1/2] (2.32ns)   --->   "%buf_load = load i4 %buf_addr" [../maxpool.h:82->../maxpool.h:110]   --->   Operation 26 'load' 'buf_load' <Predicate = (!icmp_ln74)> <Delay = 2.32> <CoreInst = "RAM">   --->   Core 82 'RAM' <Latency = 1> <II = 1> <Delay = 2.32> <Storage> <Opcode : 'load' 'store'> <Ports = 2> <Width = 64> <Depth = 14> <RAM>

State 3 <SV = 2> <Delay = 6.94>
ST_3 : Operation 27 [1/1] (0.00ns)   --->   "%specloopname_ln0 = specloopname void @_ssdm_op_SpecLoopName, void @VITIS_LOOP_74_3_VITIS_LOOP_75_4_str"   --->   Operation 27 'specloopname' 'specloopname_ln0' <Predicate = true> <Delay = 0.00>
ST_3 : Operation 28 [1/1] (0.00ns)   --->   "%speclooptripcount_ln0 = speclooptripcount void @_ssdm_op_SpecLoopTripCount, i64 28, i64 28, i64 28"   --->   Operation 28 'speclooptripcount' 'speclooptripcount_ln0' <Predicate = true> <Delay = 0.00>
ST_3 : Operation 29 [1/1] (0.00ns)   --->   "%specpipeline_ln76 = specpipeline void @_ssdm_op_SpecPipeline, i32 1, i32 0, i32 0, i32 0, void @empty_22" [../maxpool.h:76->../maxpool.h:110]   --->   Operation 29 'specpipeline' 'specpipeline_ln76' <Predicate = true> <Delay = 0.00>
ST_3 : Operation 30 [1/1] (3.63ns)   --->   "%inter2_read = read i64 @_ssdm_op_Read.ap_fifo.volatile.i64P0A, i64 %inter2" [../maxpool.h:79->../maxpool.h:110]   --->   Operation 30 'read' 'inter2_read' <Predicate = true> <Delay = 3.63> <CoreInst = "FIFO_SRL">   --->   Core 81 'FIFO_SRL' <Latency = 0> <II = 1> <Delay = 3.63> <Storage> <Opcode : 'read' 'write' 'nbread' 'nbwrite'> <Ports = 0> <Width = 64> <Depth = 2> <FIFO>
ST_3 : Operation 31 [1/1] (0.00ns) (grouped into LUT with out node or_ln82)   --->   "%or_ln82_1 = or i64 %acc, i64 %buf_load" [../maxpool.h:82->../maxpool.h:110]   --->   Operation 31 'or' 'or_ln82_1' <Predicate = true> <Delay = 0.00> <CoreInst = "LogicGate">   --->   Core 74 'LogicGate' <Latency = 0> <II = 1> <Delay = 0.99> <FuncUnit> <Opcode : 'and' 'or' 'xor'> <InPorts = 2> <OutPorts = 1>
ST_3 : Operation 32 [1/1] (0.99ns) (out node of the LUT)   --->   "%or_ln82 = or i64 %or_ln82_1, i64 %inter2_read" [../maxpool.h:82->../maxpool.h:110]   --->   Operation 32 'or' 'or_ln82' <Predicate = true> <Delay = 0.99> <CoreInst = "LogicGate">   --->   Core 74 'LogicGate' <Latency = 0> <II = 1> <Delay = 0.99> <FuncUnit> <Opcode : 'and' 'or' 'xor'> <InPorts = 2> <OutPorts = 1>
ST_3 : Operation 33 [1/1] (2.32ns)   --->   "%store_ln82 = store i64 %or_ln82, i4 %buf_addr" [../maxpool.h:82->../maxpool.h:110]   --->   Operation 33 'store' 'store_ln82' <Predicate = true> <Delay = 2.32> <CoreInst = "RAM">   --->   Core 82 'RAM' <Latency = 1> <II = 1> <Delay = 2.32> <Storage> <Opcode : 'load' 'store'> <Ports = 2> <Width = 64> <Depth = 14> <RAM>
ST_3 : Operation 34 [1/1] (0.00ns)   --->   "%br_ln75 = br void %VITIS_LOOP_78_5.i" [../maxpool.h:75->../maxpool.h:110]   --->   Operation 34 'br' 'br_ln75' <Predicate = true> <Delay = 0.00>


============================================================
+ Verbose Summary: Timing violations
============================================================
Target clock period: 10.000ns, clock uncertainty: 2.700ns.

 <State 1>: 7.670ns
The critical path consists of the following:
	'store' operation 0 bit ('store_ln75', ../maxpool.h:75->../maxpool.h:110) of constant 0 on local variable 'xp', ../maxpool.h:75->../maxpool.h:110 [7]  (1.588 ns)
	'load' operation 4 bit ('xp_load', ../maxpool.h:75->../maxpool.h:110) on local variable 'xp', ../maxpool.h:75->../maxpool.h:110 [15]  (0.000 ns)
	'icmp' operation 1 bit ('icmp_ln75', ../maxpool.h:75->../maxpool.h:110) [18]  (1.735 ns)
	'select' operation 4 bit ('select_ln74', ../maxpool.h:74->../maxpool.h:110) [19]  (1.024 ns)
	'add' operation 4 bit ('add_ln75', ../maxpool.h:75->../maxpool.h:110) [29]  (1.735 ns)
	'store' operation 0 bit ('store_ln75', ../maxpool.h:75->../maxpool.h:110) of variable 'add_ln75', ../maxpool.h:75->../maxpool.h:110 on local variable 'xp', ../maxpool.h:75->../maxpool.h:110 [31]  (1.588 ns)

 <State 2>: 3.634ns
The critical path consists of the following:
	fifo read operation ('acc', ../maxpool.h:79->../maxpool.h:110) on port 'inter2' (../maxpool.h:79->../maxpool.h:110) [22]  (3.634 ns)

 <State 3>: 6.946ns
The critical path consists of the following:
	fifo read operation ('inter2_read', ../maxpool.h:79->../maxpool.h:110) on port 'inter2' (../maxpool.h:79->../maxpool.h:110) [23]  (3.634 ns)
	'or' operation 64 bit ('or_ln82', ../maxpool.h:82->../maxpool.h:110) [27]  (0.990 ns)
	'store' operation 0 bit ('store_ln82', ../maxpool.h:82->../maxpool.h:110) of variable 'or_ln82', ../maxpool.h:82->../maxpool.h:110 on array 'buf_r' [28]  (2.322 ns)


============================================================
+ Verbose Summary: Binding
============================================================
N/A
* FSMD analyzer results:
  - Output states:
 - Input state : 
  - Chain level:
	State 1
	State 2
	State 3


============================================================
+ Verbose Summary: Datapath Resource usage 
============================================================
N/A
